{
  "schema_version": "1.0.0",
  "canonical_id": "set_bar_small_A",
  "name": "Sci-fi bar interior",
  "kit_root": "assets/Ultimate Modular Sci-Fi - Feb 2021/GLB",
  "base_placeholder": "assets/placeholders/bar_scene_placeholders.glb",
  "remove_from_base": ["set_bar_small_A", "prop_bar_counter_A"],
  "layout": [
    { "piece": "FloorTile_Empty", "position": [-3, -3, -0.09] },
    { "piece": "FloorTile_Empty", "position": [-3, -1, -0.09] },
    { "piece": "FloorTile_Empty", "position": [-3, 1, -0.09] },
    { "piece": "FloorTile_Empty", "position": [-3, 3, -0.09] },
    { "piece": "FloorTile_Empty", "position": [-1, -3, -0.09] },
    { "piece": "FloorTile_Empty", "position": [-1, -1, -0.09] },
    { "piece": "FloorTile_Empty", "position": [-1, 1, -0.09] },
    { "piece": "FloorTile_Empty", "position": [-1, 3, -0.09] },
    { "piece": "FloorTile_Empty", "position": [1, -3, -0.09] },
    { "piece": "FloorTile_Empty", "position": [1, -1, -0.09] },
    { "piece": "FloorTile_Empty", "position": [1, 1, -0.09] },
    { "piece": "FloorTile_Empty", "position": [1, 3, -0.09] },
    { "piece": "FloorTile_Empty", "position": [3, -3, -0.09] },
    { "piece": "FloorTile_Empty", "position": [3, -1, -0.09] },
    { "piece": "FloorTile_Empty", "position": [3, 1, -0.09] },
    { "piece": "FloorTile_Empty", "position": [3, 3, -0.09] },
    { "piece": "Wall_2", "position": [-2, 4, 0], "z_rotation_deg": 0 },
    { "piece": "LongWindow_Wall_SideA", "position": [2, 4, 0], "z_rotation_deg": 0 },
    { "piece": "Wall_1", "position": [-4, -2, 0], "z_rotation_deg": 90 },
    { "piece": "Wall_3", "position": [-4, 2, 0], "z_rotation_deg": 90 }
  ],
  "primitive_props": [
    {
      "id": "prop_stool_A",
      "position": [1.5, -1.13, 0.0],
      "primitives": [
        { "shape": "cylinder", "radius": 0.22, "height": 0.04, "center": [0, 0, 0.02] },
        { "shape": "cylinder", "radius": 0.06, "height": 0.72, "center": [0, 0, 0.36] },
        { "shape": "cylinder", "radius": 0.16, "height": 0.04, "center": [0, 0, 0.30] },
        { "shape": "cylinder", "radius": 0.20, "height": 0.06, "center": [0, 0, 0.72] }
      ],
      "material": { "base_color": [0.30, 0.31, 0.35, 1.0], "roughness": 0.5 }
    },
    {
      "id": "prop_bar_counter_A",
      "position": [0.0, 0.0, 0.0],
      "primitives": [
        { "shape": "box", "size": [5.8, 1.30, 0.1455], "center": [0, 0, 0.07275] },
        { "shape": "box", "size": [5.6, 1.10, 0.8245], "center": [0, 0, 0.55775] },
        { "shape": "box", "size": [6.0, 1.40, 0.1164], "center": [0, 0, 1.0282] }
      ],
      "material": { "base_color": [0.28, 0.29, 0.33, 1.0], "roughness": 0.6 }
    }
  ],
  "marks": [
    { "name": "hero_barstool_A", "position": [1.5, -1.13, 0.31] },
    { "name": "hero_stool_front_A", "position": [1.05, -1.13, 0.0] }
  ],
  "cameras": [
    {
      "name": "cam_medium_bartender",
      "position": [-0.5, -1.8, 1.45],
      "aim_at": [-0.5, 0.5, 1.3],
      "lens_mm": 35
    },
    {
      "name": "cam_medium_hero_back",
      "position": [2.7402634620666504, -2.140814757347107, 1.55],
      "aim_at": [-0.5, 0.5, 1.25],
      "lens_mm": 35
    }
  ],
  "material_fixes": { "force_opaque": true },
  "canonical_node": "set_bar_small_A",
  "export": { "usdc": true }
}
